,object,id,created_time,last_edited_time,created_by,last_edited_by,cover,icon,parent,archived,in_trash,properties,url,public_url
34,page,e465f55d-74c4-42c4-bb93-c056ef05e56a,2023-10-26T02:49:00.000Z,2023-10-26T02:51:00.000Z,"{'object': 'user', 'id': '147bdf86-4261-4d70-ba95-2923623aa778'}","{'object': 'user', 'id': '147bdf86-4261-4d70-ba95-2923623aa778'}",,,"{'type': 'database_id', 'database_id': '54cb3960-b402-46e2-be42-cfb58e2b45fd'}",False,False,"{'Last edited time': {'id': 'FM%3Dx', 'type': 'last_edited_time', 'last_edited_time': '2023-10-26T02:51:00.000Z'}, 'ConferenceDate': {'id': 'JnqY', 'type': 'date', 'date': {'start': '2023-12-10', 'end': None, 'time_zone': None}}, 'Authors': {'id': 'Km%3Db', 'type': 'rich_text', 'rich_text': [{'type': 'text', 'text': {'content': 'Fangcheng Zhong, Kyle Fogarty, Param Hanji, Tianhao Wu, Alejandro Sztrajman, Andrew Spielberg, Andrea Tagliasacchi, Petra Bosilj, Cengiz Oztireli', 'link': None}, 'annotations': {'bold': False, 'italic': False, 'strikethrough': False, 'underline': False, 'code': False, 'color': 'default'}, 'plain_text': 'Fangcheng Zhong, Kyle Fogarty, Param Hanji, Tianhao Wu, Alejandro Sztrajman, Andrew Spielberg, Andrea Tagliasacchi, Petra Bosilj, Cengiz Oztireli', 'href': None}]}, 'Last edited by': {'id': 'MZ%40S', 'type': 'last_edited_by', 'last_edited_by': {'object': 'user', 'id': '147bdf86-4261-4d70-ba95-2923623aa778'}}, 'Abstract': {'id': 'UIOf', 'type': 'rich_text', 'rich_text': [{'type': 'text', 'text': {'content': 'While deep learning techniques have become extremely popular for solving a broad range of optimization problems, methods to enforce hard constraints during optimization, particularly on deep neural networks, remain underdeveloped. Inspired by the rich literature on meshless interpolation and its extension to spectral collocation methods in scientific computing, we develop a series of approaches for enforcing hard constraints on neural fields, which we refer to as \\emph{Constrained Neural Fields} (CNF). The constraints can be specified as a linear operator applied to the neural field and its derivatives. We also design specific model representations and training strategies for problems where standard models may encounter difficulties, such as conditioning of the system, memory consumption, and capacity of the network when being constrained. Our approaches are demonstrated in a wide range of real-world applications. Additionally, we develop a framework that enables highly efficient model and constraint specification, which can be readily applied to any downstream task where hard constraints need to be explicitly satisfied during optimization.', 'link': None}, 'annotations': {'bold': False, 'italic': False, 'strikethrough': False, 'underline': False, 'code': False, 'color': 'default'}, 'plain_text': 'While deep learning techniques have become extremely popular for solving a broad range of optimization problems, methods to enforce hard constraints during optimization, particularly on deep neural networks, remain underdeveloped. Inspired by the rich literature on meshless interpolation and its extension to spectral collocation methods in scientific computing, we develop a series of approaches for enforcing hard constraints on neural fields, which we refer to as \\emph{Constrained Neural Fields} (CNF). The constraints can be specified as a linear operator applied to the neural field and its derivatives. We also design specific model representations and training strategies for problems where standard models may encounter difficulties, such as conditioning of the system, memory consumption, and capacity of the network when being constrained. Our approaches are demonstrated in a wide range of real-world applications. Additionally, we develop a framework that enables highly efficient model and constraint specification, which can be readily applied to any downstream task where hard constraints need to be explicitly satisfied during optimization.', 'href': None}]}, 'Thumbnail': {'id': 'YalY', 'type': 'files', 'files': [{'name': 'https://taiya.github.io/images/placeholder.jpg', 'type': 'external', 'external': {'url': 'https://taiya.github.io/images/placeholder.jpg'}}]}, 'project_link': {'id': '%5D%5EpD', 'type': 'rich_text', 'rich_text': [{'type': 'text', 'text': {'content': 'https://arxiv.org/abs/2306.08943', 'link': {'url': 'https://arxiv.org/abs/2306.08943'}}, 'annotations': {'bold': False, 'italic': False, 'strikethrough': False, 'underline': False, 'code': False, 'color': 'default'}, 'plain_text': 'https://arxiv.org/abs/2306.08943', 'href': 'https://arxiv.org/abs/2306.08943'}]}, 'Venue': {'id': '_e%40%3F', 'type': 'rich_text', 'rich_text': [{'type': 'text', 'text': {'content': 'NeurIPS 2023', 'link': None}, 'annotations': {'bold': False, 'italic': False, 'strikethrough': False, 'underline': False, 'code': False, 'color': 'default'}, 'plain_text': 'NeurIPS 2023', 'href': None}]}, 'Created by': {'id': 'aBTi', 'type': 'created_by', 'created_by': {'object': 'user', 'id': '147bdf86-4261-4d70-ba95-2923623aa778'}}, 'video_link': {'id': 'k%5Ei%5D', 'type': 'rich_text', 'rich_text': []}, 'presentation_link': {'id': 'lwp%7D', 'type': 'rich_text', 'rich_text': []}, 'Tags': {'id': 'mula', 'type': 'multi_select', 'multi_select': [{'id': 'bb1c7b2a-93d8-4f0d-9e32-2a3594a652cd', 'name': 'NeurIPS', 'color': 'default'}, {'id': '1a31dc62-0b3c-4bfe-8684-3ffe669325d3', 'name': 'Andrea', 'color': 'purple'}]}, 'paper_link': {'id': 'ut%5Ex', 'type': 'rich_text', 'rich_text': [{'type': 'text', 'text': {'content': 'https://arxiv.org/abs/2306.08943', 'link': {'url': 'https://arxiv.org/abs/2306.08943'}}, 'annotations': {'bold': False, 'italic': False, 'strikethrough': False, 'underline': False, 'code': False, 'color': 'default'}, 'plain_text': 'https://arxiv.org/abs/2306.08943', 'href': 'https://arxiv.org/abs/2306.08943'}]}, 'If Valid': {'id': '%7C%3DNR', 'type': 'formula', 'formula': {'type': 'string', 'string': '✔️'}}, 'Name': {'id': 'title', 'type': 'title', 'title': [{'type': 'text', 'text': {'content': 'Neural Fields with Hard Constraints of Arbitrary Differential Order', 'link': None}, 'annotations': {'bold': False, 'italic': False, 'strikethrough': False, 'underline': False, 'code': False, 'color': 'default'}, 'plain_text': 'Neural Fields with Hard Constraints of Arbitrary Differential Order', 'href': None}]}}",https://www.notion.so/Neural-Fields-with-Hard-Constraints-of-Arbitrary-Differential-Order-e465f55d74c442c4bb93c056ef05e56a,https://yanxg.notion.site/Neural-Fields-with-Hard-Constraints-of-Arbitrary-Differential-Order-e465f55d74c442c4bb93c056ef05e56a
35,page,e40d79ba-70ee-4aee-86a4-023047c0b26d,2023-10-26T02:48:00.000Z,2023-10-26T02:51:00.000Z,"{'object': 'user', 'id': '147bdf86-4261-4d70-ba95-2923623aa778'}","{'object': 'user', 'id': '147bdf86-4261-4d70-ba95-2923623aa778'}",,,"{'type': 'database_id', 'database_id': '54cb3960-b402-46e2-be42-cfb58e2b45fd'}",False,False,"{'Last edited time': {'id': 'FM%3Dx', 'type': 'last_edited_time', 'last_edited_time': '2023-10-26T02:51:00.000Z'}, 'ConferenceDate': {'id': 'JnqY', 'type': 'date', 'date': {'start': '2023-12-10', 'end': None, 'time_zone': None}}, 'Authors': {'id': 'Km%3Db', 'type': 'rich_text', 'rich_text': [{'type': 'text', 'text': {'content': 'Eric Hedlin, Gopal Sharma, Shweta Mahajan, Hossam Isack, Abhishek Kar, Andrea Tagliasacchi, Kwang Moo Yi', 'link': None}, 'annotations': {'bold': False, 'italic': False, 'strikethrough': False, 'underline': False, 'code': False, 'color': 'default'}, 'plain_text': 'Eric Hedlin, Gopal Sharma, Shweta Mahajan, Hossam Isack, Abhishek Kar, Andrea Tagliasacchi, Kwang Moo Yi', 'href': None}]}, 'Last edited by': {'id': 'MZ%40S', 'type': 'last_edited_by', 'last_edited_by': {'object': 'user', 'id': '147bdf86-4261-4d70-ba95-2923623aa778'}}, 'Abstract': {'id': 'UIOf', 'type': 'rich_text', 'rich_text': [{'type': 'text', 'text': {'content': 'Text-to-image diffusion models are now capable of generating images that are often indistinguishable from real images. To generate such images, these models must understand the semantics of the objects they are asked to generate. In this work we show that, without any training, one can leverage this semantic knowledge within diffusion models to find semantic correspondences -- locations in multiple images that have the same semantic meaning. Specifically, given an image, we optimize the prompt embeddings of these models for maximum attention on the regions of interest. These optimized embeddings capture semantic information about the location, which can then be transferred to another image. By doing so we obtain results on par with the strongly supervised state of the art on the PF-Willow dataset and significantly outperform (20.9% relative for the SPair-71k dataset) any existing weakly or unsupervised method on PF-Willow, CUB-200 and SPair-71k datasets.', 'link': None}, 'annotations': {'bold': False, 'italic': False, 'strikethrough': False, 'underline': False, 'code': False, 'color': 'default'}, 'plain_text': 'Text-to-image diffusion models are now capable of generating images that are often indistinguishable from real images. To generate such images, these models must understand the semantics of the objects they are asked to generate. In this work we show that, without any training, one can leverage this semantic knowledge within diffusion models to find semantic correspondences -- locations in multiple images that have the same semantic meaning. Specifically, given an image, we optimize the prompt embeddings of these models for maximum attention on the regions of interest. These optimized embeddings capture semantic information about the location, which can then be transferred to another image. By doing so we obtain results on par with the strongly supervised state of the art on the PF-Willow dataset and significantly outperform (20.9% relative for the SPair-71k dataset) any existing weakly or unsupervised method on PF-Willow, CUB-200 and SPair-71k datasets.', 'href': None}]}, 'Thumbnail': {'id': 'YalY', 'type': 'files', 'files': [{'name': 'https://taiya.github.io/images/placeholder.jpg', 'type': 'external', 'external': {'url': 'https://taiya.github.io/images/placeholder.jpg'}}]}, 'project_link': {'id': '%5D%5EpD', 'type': 'rich_text', 'rich_text': [{'type': 'text', 'text': {'content': 'https://ubc-vision.github.io/LDM_correspondences/', 'link': {'url': 'https://ubc-vision.github.io/LDM_correspondences/'}}, 'annotations': {'bold': False, 'italic': False, 'strikethrough': False, 'underline': False, 'code': False, 'color': 'default'}, 'plain_text': 'https://ubc-vision.github.io/LDM_correspondences/', 'href': 'https://ubc-vision.github.io/LDM_correspondences/'}]}, 'Venue': {'id': '_e%40%3F', 'type': 'rich_text', 'rich_text': [{'type': 'text', 'text': {'content': 'NeurIPS 2023', 'link': None}, 'annotations': {'bold': False, 'italic': False, 'strikethrough': False, 'underline': False, 'code': False, 'color': 'default'}, 'plain_text': 'NeurIPS 2023', 'href': None}]}, 'Created by': {'id': 'aBTi', 'type': 'created_by', 'created_by': {'object': 'user', 'id': '147bdf86-4261-4d70-ba95-2923623aa778'}}, 'video_link': {'id': 'k%5Ei%5D', 'type': 'rich_text', 'rich_text': []}, 'presentation_link': {'id': 'lwp%7D', 'type': 'rich_text', 'rich_text': []}, 'Tags': {'id': 'mula', 'type': 'multi_select', 'multi_select': [{'id': 'bb1c7b2a-93d8-4f0d-9e32-2a3594a652cd', 'name': 'NeurIPS', 'color': 'default'}, {'id': '1a31dc62-0b3c-4bfe-8684-3ffe669325d3', 'name': 'Andrea', 'color': 'purple'}]}, 'paper_link': {'id': 'ut%5Ex', 'type': 'rich_text', 'rich_text': [{'type': 'text', 'text': {'content': 'https://arxiv.org/abs/2305.15581', 'link': {'url': 'https://arxiv.org/abs/2306.08943'}}, 'annotations': {'bold': False, 'italic': False, 'strikethrough': False, 'underline': False, 'code': False, 'color': 'default'}, 'plain_text': 'https://arxiv.org/abs/2305.15581', 'href': 'https://arxiv.org/abs/2306.08943'}]}, 'If Valid': {'id': '%7C%3DNR', 'type': 'formula', 'formula': {'type': 'string', 'string': '✔️'}}, 'Name': {'id': 'title', 'type': 'title', 'title': [{'type': 'text', 'text': {'content': 'Unsupervised Semantic Correspondence Using Stable Diffusion', 'link': None}, 'annotations': {'bold': False, 'italic': False, 'strikethrough': False, 'underline': False, 'code': False, 'color': 'default'}, 'plain_text': 'Unsupervised Semantic Correspondence Using Stable Diffusion', 'href': None}]}}",https://www.notion.so/Unsupervised-Semantic-Correspondence-Using-Stable-Diffusion-e40d79ba70ee4aee86a4023047c0b26d,https://yanxg.notion.site/Unsupervised-Semantic-Correspondence-Using-Stable-Diffusion-e40d79ba70ee4aee86a4023047c0b26d
36,page,062f2450-a093-4a1d-afc7-127b9ff2af39,2023-10-26T02:00:00.000Z,2023-10-26T02:09:00.000Z,"{'object': 'user', 'id': 'f31fa168-6351-401c-86ba-83d31c9bfe45'}","{'object': 'user', 'id': 'f31fa168-6351-401c-86ba-83d31c9bfe45'}",,,"{'type': 'database_id', 'database_id': '54cb3960-b402-46e2-be42-cfb58e2b45fd'}",False,False,"{'Last edited time': {'id': 'FM%3Dx', 'type': 'last_edited_time', 'last_edited_time': '2023-10-26T02:09:00.000Z'}, 'ConferenceDate': {'id': 'JnqY', 'type': 'date', 'date': {'start': '2023-12-10', 'end': None, 'time_zone': None}}, 'Authors': {'id': 'Km%3Db', 'type': 'rich_text', 'rich_text': [{'type': 'text', 'text': {'content': 'Zahra Gharaee, Zeming Gong, Nicholas Pellegrino, Iuliia Zarubiieva,\xa0Joakim Bruslund Haurum,\xa0Scott C Lowe, Jaclyn TA McKeown, Chris CY Ho, Joschka McLeod, Yi-Yun C Wei, Jireh Agda, Sujeevan Ratnasingham, Dirk Steinke,\xa0Angel X. Chang,', 'link': None}, 'annotations': {'bold': False, 'italic': False, 'strikethrough': False, 'underline': False, 'code': False, 'color': 'default'}, 'plain_text': 'Zahra Gharaee, Zeming Gong, Nicholas Pellegrino, Iuliia Zarubiieva,\xa0Joakim Bruslund Haurum,\xa0Scott C Lowe, Jaclyn TA McKeown, Chris CY Ho, Joschka McLeod, Yi-Yun C Wei, Jireh Agda, Sujeevan Ratnasingham, Dirk Steinke,\xa0Angel X. Chang,', 'href': None}, {'type': 'text', 'text': {'content': '\xa0', 'link': None}, 'annotations': {'bold': True, 'italic': False, 'strikethrough': False, 'underline': False, 'code': False, 'color': 'default'}, 'plain_text': '\xa0', 'href': None}, {'type': 'text', 'text': {'content': 'Graham W Taylor,\xa0Paul Fieguth', 'link': None}, 'annotations': {'bold': False, 'italic': False, 'strikethrough': False, 'underline': False, 'code': False, 'color': 'default'}, 'plain_text': 'Graham W Taylor,\xa0Paul Fieguth', 'href': None}]}, 'Last edited by': {'id': 'MZ%40S', 'type': 'last_edited_by', 'last_edited_by': {'object': 'user', 'id': 'f31fa168-6351-401c-86ba-83d31c9bfe45'}}, 'Abstract': {'id': 'UIOf', 'type': 'rich_text', 'rich_text': [{'type': 'text', 'text': {'content': 'In an effort to catalog insect biodiversity, we propose a new large dataset of hand-labelled insect images, the BIOSCAN-Insect Dataset. Each record is taxonomically classified by an expert, and also has associated genetic information including raw nucleotide barcode sequences and assigned barcode index numbers, which are genetically-based proxies for species classification. This paper presents a curated million-image dataset, primarily to train computer-vision models capable of providing image-based taxonomic assessment, however, the dataset also presents compelling characteristics, the study of which would be of interest to the broader machine learning community. Driven by the biological nature inherent to the dataset, a characteristic long-tailed class-imbalance distribution is exhibited. Furthermore, taxonomic labelling is a hierarchical classification scheme, presenting a highly fine-grained classification problem at lower levels. Beyond spurring interest in biodiversity research within the machine learning community, progress on creating an image-based taxonomic classifier will also further the ultimate goal of all BIOSCAN research: to lay the foundation for a comprehensive survey of global biodiversity. This paper introduces the dataset and explores the classification task through the implementation and analysis of a baseline classifier.', 'link': None}, 'annotations': {'bold': False, 'italic': False, 'strikethrough': False, 'underline': False, 'code': False, 'color': 'default'}, 'plain_text': 'In an effort to catalog insect biodiversity, we propose a new large dataset of hand-labelled insect images, the BIOSCAN-Insect Dataset. Each record is taxonomically classified by an expert, and also has associated genetic information including raw nucleotide barcode sequences and assigned barcode index numbers, which are genetically-based proxies for species classification. This paper presents a curated million-image dataset, primarily to train computer-vision models capable of providing image-based taxonomic assessment, however, the dataset also presents compelling characteristics, the study of which would be of interest to the broader machine learning community. Driven by the biological nature inherent to the dataset, a characteristic long-tailed class-imbalance distribution is exhibited. Furthermore, taxonomic labelling is a hierarchical classification scheme, presenting a highly fine-grained classification problem at lower levels. Beyond spurring interest in biodiversity research within the machine learning community, progress on creating an image-based taxonomic classifier will also further the ultimate goal of all BIOSCAN research: to lay the foundation for a comprehensive survey of global biodiversity. This paper introduces the dataset and explores the classification task through the implementation and analysis of a baseline classifier.', 'href': None}]}, 'Thumbnail': {'id': 'YalY', 'type': 'files', 'files': [{'name': 'bioscan1m.png', 'type': 'file', 'file': {'url': 'https://prod-files-secure.s3.us-west-2.amazonaws.com/50d2f7ab-6ba6-45d4-bc3a-917e5e89e239/f8b23333-750f-442c-88b7-76d10c28bb28/bioscan1m.png?X-Amz-Algorithm=AWS4-HMAC-SHA256&X-Amz-Content-Sha256=UNSIGNED-PAYLOAD&X-Amz-Credential=AKIAT73L2G45HZZMZUHI%2F20240923%2Fus-west-2%2Fs3%2Faws4_request&X-Amz-Date=20240923T192254Z&X-Amz-Expires=3600&X-Amz-Signature=a17a031269e012a9a8e4ff413db69376e55fb5c9e5f0378a611ce627661cb216&X-Amz-SignedHeaders=host&x-id=GetObject', 'expiry_time': '2024-09-23T20:22:54.145Z'}}]}, 'project_link': {'id': '%5D%5EpD', 'type': 'rich_text', 'rich_text': [{'type': 'text', 'text': {'content': 'https://biodiversitygenomics.net/1M_insects/', 'link': {'url': 'https://biodiversitygenomics.net/1M_insects/'}}, 'annotations': {'bold': False, 'italic': False, 'strikethrough': False, 'underline': False, 'code': False, 'color': 'default'}, 'plain_text': 'https://biodiversitygenomics.net/1M_insects/', 'href': 'https://biodiversitygenomics.net/1M_insects/'}]}, 'Venue': {'id': '_e%40%3F', 'type': 'rich_text', 'rich_text': [{'type': 'text', 'text': {'content': 'NeurIPS Datasets and Benchmarks Track 2023', 'link': None}, 'annotations': {'bold': False, 'italic': False, 'strikethrough': False, 'underline': False, 'code': False, 'color': 'default'}, 'plain_text': 'NeurIPS Datasets and Benchmarks Track 2023', 'href': None}]}, 'Created by': {'id': 'aBTi', 'type': 'created_by', 'created_by': {'object': 'user', 'id': 'f31fa168-6351-401c-86ba-83d31c9bfe45'}}, 'video_link': {'id': 'k%5Ei%5D', 'type': 'rich_text', 'rich_text': []}, 'presentation_link': {'id': 'lwp%7D', 'type': 'rich_text', 'rich_text': []}, 'Tags': {'id': 'mula', 'type': 'multi_select', 'multi_select': [{'id': '6a51b57b-f1f8-4b18-ac73-a0ace74eb41a', 'name': 'NeurIPS Datasets and Benchmarks', 'color': 'blue'}, {'id': '3f09b3b2-12ce-418c-8bbd-329349d82802', 'name': 'Angel', 'color': 'brown'}]}, 'paper_link': {'id': 'ut%5Ex', 'type': 'rich_text', 'rich_text': [{'type': 'text', 'text': {'content': 'https://arxiv.org/abs/2307.10455', 'link': {'url': 'https://arxiv.org/abs/2307.10455'}}, 'annotations': {'bold': False, 'italic': False, 'strikethrough': False, 'underline': False, 'code': False, 'color': 'default'}, 'plain_text': 'https://arxiv.org/abs/2307.10455', 'href': 'https://arxiv.org/abs/2307.10455'}]}, 'If Valid': {'id': '%7C%3DNR', 'type': 'formula', 'formula': {'type': 'string', 'string': '✔️'}}, 'Name': {'id': 'title', 'type': 'title', 'title': [{'type': 'text', 'text': {'content': 'A Step Towards Worldwide Biodiversity Assessment: The BIOSCAN-1M Insect Dataset', 'link': None}, 'annotations': {'bold': True, 'italic': False, 'strikethrough': False, 'underline': False, 'code': False, 'color': 'default'}, 'plain_text': 'A Step Towards Worldwide Biodiversity Assessment: The BIOSCAN-1M Insect Dataset', 'href': None}]}}",https://www.notion.so/A-Step-Towards-Worldwide-Biodiversity-Assessment-The-BIOSCAN-1M-Insect-Dataset-062f2450a0934a1dafc7127b9ff2af39,https://yanxg.notion.site/A-Step-Towards-Worldwide-Biodiversity-Assessment-The-BIOSCAN-1M-Insect-Dataset-062f2450a0934a1dafc7127b9ff2af39
37,page,b595d4de-624c-430c-a679-0429d50269dc,2023-10-25T23:13:00.000Z,2023-11-22T03:13:00.000Z,"{'object': 'user', 'id': '1d0f9cba-2d4d-4ca0-94d8-926cdf288b37'}","{'object': 'user', 'id': 'b8d7e6d8-82a6-4b57-b07a-0fdcc828f6c5'}",,,"{'type': 'database_id', 'database_id': '54cb3960-b402-46e2-be42-cfb58e2b45fd'}",False,False,"{'Last edited time': {'id': 'FM%3Dx', 'type': 'last_edited_time', 'last_edited_time': '2023-11-22T03:13:00.000Z'}, 'ConferenceDate': {'id': 'JnqY', 'type': 'date', 'date': {'start': '2023-12-10', 'end': None, 'time_zone': None}}, 'Authors': {'id': 'Km%3Db', 'type': 'rich_text', 'rich_text': [{'type': 'text', 'text': {'content': 'Yanshu Zhang*,\xa0Shichong Peng*,\xa0Seyed Alireza Moazenipourasil,\xa0Ke Li', 'link': None}, 'annotations': {'bold': False, 'italic': False, 'strikethrough': False, 'underline': False, 'code': False, 'color': 'default'}, 'plain_text': 'Yanshu Zhang*,\xa0Shichong Peng*,\xa0Seyed Alireza Moazenipourasil,\xa0Ke Li', 'href': None}]}, 'Last edited by': {'id': 'MZ%40S', 'type': 'last_edited_by', 'last_edited_by': {'object': 'user', 'id': 'b8d7e6d8-82a6-4b57-b07a-0fdcc828f6c5'}}, 'Abstract': {'id': 'UIOf', 'type': 'rich_text', 'rich_text': [{'type': 'text', 'text': {'content': 'Given a set of images from different views and their corresponding camera poses, PAPR learns a point-based surface representation of the scene and a rendering pipeline from scratch. Additionally, PAPR enables practical applications such as\xa0geometry editing,\xa0object manipulation,\xa0texture transfer, and\xa0exposure control.', 'link': None}, 'annotations': {'bold': False, 'italic': False, 'strikethrough': False, 'underline': False, 'code': False, 'color': 'default'}, 'plain_text': 'Given a set of images from different views and their corresponding camera poses, PAPR learns a point-based surface representation of the scene and a rendering pipeline from scratch. Additionally, PAPR enables practical applications such as\xa0geometry editing,\xa0object manipulation,\xa0texture transfer, and\xa0exposure control.', 'href': None}]}, 'Thumbnail': {'id': 'YalY', 'type': 'files', 'files': [{'name': 'papr-thumbnail2.png', 'type': 'file', 'file': {'url': 'https://prod-files-secure.s3.us-west-2.amazonaws.com/50d2f7ab-6ba6-45d4-bc3a-917e5e89e239/cb623732-7a24-44bf-b9de-f5bd5be90bad/papr-thumbnail2.png?X-Amz-Algorithm=AWS4-HMAC-SHA256&X-Amz-Content-Sha256=UNSIGNED-PAYLOAD&X-Amz-Credential=AKIAT73L2G45HZZMZUHI%2F20240923%2Fus-west-2%2Fs3%2Faws4_request&X-Amz-Date=20240923T192254Z&X-Amz-Expires=3600&X-Amz-Signature=93de85cb50281227262ed65b83560a63a3e23970185992d0e60b77d0a48ea2ce&X-Amz-SignedHeaders=host&x-id=GetObject', 'expiry_time': '2024-09-23T20:22:54.145Z'}}]}, 'project_link': {'id': '%5D%5EpD', 'type': 'rich_text', 'rich_text': [{'type': 'text', 'text': {'content': 'https://zvict.github.io/papr/', 'link': {'url': 'https://zvict.github.io/papr/'}}, 'annotations': {'bold': False, 'italic': False, 'strikethrough': False, 'underline': False, 'code': False, 'color': 'default'}, 'plain_text': 'https://zvict.github.io/papr/', 'href': 'https://zvict.github.io/papr/'}]}, 'Venue': {'id': '_e%40%3F', 'type': 'rich_text', 'rich_text': [{'type': 'text', 'text': {'content': 'NeurIPS 2023', 'link': None}, 'annotations': {'bold': False, 'italic': False, 'strikethrough': False, 'underline': False, 'code': False, 'color': 'default'}, 'plain_text': 'NeurIPS 2023', 'href': None}]}, 'Created by': {'id': 'aBTi', 'type': 'created_by', 'created_by': {'object': 'user', 'id': '1d0f9cba-2d4d-4ca0-94d8-926cdf288b37'}}, 'video_link': {'id': 'k%5Ei%5D', 'type': 'rich_text', 'rich_text': []}, 'presentation_link': {'id': 'lwp%7D', 'type': 'rich_text', 'rich_text': []}, 'Tags': {'id': 'mula', 'type': 'multi_select', 'multi_select': [{'id': 'bb1c7b2a-93d8-4f0d-9e32-2a3594a652cd', 'name': 'NeurIPS', 'color': 'default'}, {'id': '9ea36cd3-48d3-462d-baf9-b75ef77f4121', 'name': 'Ke', 'color': 'brown'}]}, 'paper_link': {'id': 'ut%5Ex', 'type': 'rich_text', 'rich_text': [{'type': 'text', 'text': {'content': 'https://arxiv.org/abs/2307.11086', 'link': {'url': 'https://arxiv.org/abs/2307.11086'}}, 'annotations': {'bold': False, 'italic': False, 'strikethrough': False, 'underline': False, 'code': False, 'color': 'default'}, 'plain_text': 'https://arxiv.org/abs/2307.11086', 'href': 'https://arxiv.org/abs/2307.11086'}]}, 'If Valid': {'id': '%7C%3DNR', 'type': 'formula', 'formula': {'type': 'string', 'string': '✔️'}}, 'Name': {'id': 'title', 'type': 'title', 'title': [{'type': 'text', 'text': {'content': 'PAPR: Proximity Attention Point Rendering', 'link': None}, 'annotations': {'bold': True, 'italic': False, 'strikethrough': False, 'underline': False, 'code': False, 'color': 'default'}, 'plain_text': 'PAPR: Proximity Attention Point Rendering', 'href': None}]}}",https://www.notion.so/PAPR-Proximity-Attention-Point-Rendering-b595d4de624c430ca6790429d50269dc,https://yanxg.notion.site/PAPR-Proximity-Attention-Point-Rendering-b595d4de624c430ca6790429d50269dc
