,object,id,created_time,last_edited_time,created_by,last_edited_by,cover,icon,parent,archived,in_trash,properties,url,public_url
16,page,5c4bb6dc-8a2b-4ba0-a9b2-186e7066f7e5,2024-07-23T01:38:00.000Z,2024-07-23T01:40:00.000Z,"{'object': 'user', 'id': '11ba016d-f263-498e-a669-058948397991'}","{'object': 'user', 'id': '11ba016d-f263-498e-a669-058948397991'}",,,"{'type': 'database_id', 'database_id': '54cb3960-b402-46e2-be42-cfb58e2b45fd'}",False,False,"{'Last edited time': {'id': 'FM%3Dx', 'type': 'last_edited_time', 'last_edited_time': '2024-07-23T01:40:00.000Z'}, 'ConferenceDate': {'id': 'JnqY', 'type': 'date', 'date': {'start': '2024-07-22', 'end': None, 'time_zone': None}}, 'Authors': {'id': 'Km%3Db', 'type': 'rich_text', 'rich_text': [{'type': 'text', 'text': {'content': 'Lily Goli, Cody Reading, Silvia Sellan, Alec Jacobson, Andrea Tagliasacchi', 'link': None}, 'annotations': {'bold': False, 'italic': False, 'strikethrough': False, 'underline': False, 'code': False, 'color': 'default'}, 'plain_text': 'Lily Goli, Cody Reading, Silvia Sellan, Alec Jacobson, Andrea Tagliasacchi', 'href': None}]}, 'Last edited by': {'id': 'MZ%40S', 'type': 'last_edited_by', 'last_edited_by': {'object': 'user', 'id': '11ba016d-f263-498e-a669-058948397991'}}, 'Abstract': {'id': 'UIOf', 'type': 'rich_text', 'rich_text': [{'type': 'text', 'text': {'content': 'Neural Radiance Fields (NeRFs) have shown promise in applications like view synthesis and depth estimation, but their learning from multiview images faces inherent uncertainties. Current methods to quantify them are either heuristic or computationally demanding. We introduce\xa0', 'link': None}, 'annotations': {'bold': False, 'italic': False, 'strikethrough': False, 'underline': False, 'code': False, 'color': 'default'}, 'plain_text': 'Neural Radiance Fields (NeRFs) have shown promise in applications like view synthesis and depth estimation, but their learning from multiview images faces inherent uncertainties. Current methods to quantify them are either heuristic or computationally demanding. We introduce\xa0', 'href': None}, {'type': 'text', 'text': {'content': 'BaysRays', 'link': None}, 'annotations': {'bold': False, 'italic': True, 'strikethrough': False, 'underline': False, 'code': False, 'color': 'default'}, 'plain_text': 'BaysRays', 'href': None}, {'type': 'text', 'text': {'content': ', a post-hoc framework to evaluate uncertainty in any pre-trained NeRF without modifying the training process. Our method establishes a volumetric uncertainty field using spatial perturbations and a Bayesian Laplace approximation. We derive our algorithm statistically and highlight its superior performance in key metrics and NeRF-related applications.', 'link': None}, 'annotations': {'bold': False, 'italic': False, 'strikethrough': False, 'underline': False, 'code': False, 'color': 'default'}, 'plain_text': ', a post-hoc framework to evaluate uncertainty in any pre-trained NeRF without modifying the training process. Our method establishes a volumetric uncertainty field using spatial perturbations and a Bayesian Laplace approximation. We derive our algorithm statistically and highlight its superior performance in key metrics and NeRF-related applications.', 'href': None}]}, 'Thumbnail': {'id': 'YalY', 'type': 'files', 'files': [{'name': 'Screenshot 2024-07-22 at 6.39.51\u202fPM.png', 'type': 'file', 'file': {'url': 'https://prod-files-secure.s3.us-west-2.amazonaws.com/50d2f7ab-6ba6-45d4-bc3a-917e5e89e239/51452dad-d156-484f-b88e-996c0d009bf6/Screenshot_2024-07-22_at_6.39.51_PM.png?X-Amz-Algorithm=AWS4-HMAC-SHA256&X-Amz-Content-Sha256=UNSIGNED-PAYLOAD&X-Amz-Credential=AKIAT73L2G45HZZMZUHI%2F20240923%2Fus-west-2%2Fs3%2Faws4_request&X-Amz-Date=20240923T192254Z&X-Amz-Expires=3600&X-Amz-Signature=7687bdde59c601169bc37f06411368abeb1a31ec20e148305ebe0703049c38b4&X-Amz-SignedHeaders=host&x-id=GetObject', 'expiry_time': '2024-09-23T20:22:54.142Z'}}]}, 'project_link': {'id': '%5D%5EpD', 'type': 'rich_text', 'rich_text': [{'type': 'text', 'text': {'content': 'https://bayesrays.github.io', 'link': {'url': 'https://bayesrays.github.io/'}}, 'annotations': {'bold': False, 'italic': False, 'strikethrough': False, 'underline': False, 'code': False, 'color': 'default'}, 'plain_text': 'https://bayesrays.github.io', 'href': 'https://bayesrays.github.io/'}]}, 'Venue': {'id': '_e%40%3F', 'type': 'rich_text', 'rich_text': [{'type': 'text', 'text': {'content': 'CVPR 2024', 'link': None}, 'annotations': {'bold': False, 'italic': False, 'strikethrough': False, 'underline': False, 'code': False, 'color': 'default'}, 'plain_text': 'CVPR 2024', 'href': None}]}, 'Created by': {'id': 'aBTi', 'type': 'created_by', 'created_by': {'object': 'user', 'id': '11ba016d-f263-498e-a669-058948397991'}}, 'video_link': {'id': 'k%5Ei%5D', 'type': 'rich_text', 'rich_text': []}, 'presentation_link': {'id': 'lwp%7D', 'type': 'rich_text', 'rich_text': []}, 'Tags': {'id': 'mula', 'type': 'multi_select', 'multi_select': [{'id': '1a31dc62-0b3c-4bfe-8684-3ffe669325d3', 'name': 'Andrea', 'color': 'purple'}, {'id': '1ffd3246-db7a-4ea8-855d-f920b194ab96', 'name': 'CVPR', 'color': 'orange'}]}, 'paper_link': {'id': 'ut%5Ex', 'type': 'rich_text', 'rich_text': [{'type': 'text', 'text': {'content': 'https://github.com/BayesRays/bayesrays.github.io/raw/main/BayesRays.pdf', 'link': {'url': 'https://github.com/BayesRays/bayesrays.github.io/raw/main/BayesRays.pdf'}}, 'annotations': {'bold': False, 'italic': False, 'strikethrough': False, 'underline': False, 'code': False, 'color': 'default'}, 'plain_text': 'https://github.com/BayesRays/bayesrays.github.io/raw/main/BayesRays.pdf', 'href': 'https://github.com/BayesRays/bayesrays.github.io/raw/main/BayesRays.pdf'}]}, 'If Valid': {'id': '%7C%3DNR', 'type': 'formula', 'formula': {'type': 'string', 'string': '✔️'}}, 'Name': {'id': 'title', 'type': 'title', 'title': [{'type': 'text', 'text': {'content': ""Bayes' Rays: Uncertainty Quantification for Neural Radiance Fields"", 'link': None}, 'annotations': {'bold': True, 'italic': False, 'strikethrough': False, 'underline': False, 'code': False, 'color': 'default'}, 'plain_text': ""Bayes' Rays: Uncertainty Quantification for Neural Radiance Fields"", 'href': None}]}}",https://www.notion.so/Bayes-Rays-Uncertainty-Quantification-for-Neural-Radiance-Fields-5c4bb6dc8a2b4ba0a9b2186e7066f7e5,https://yanxg.notion.site/Bayes-Rays-Uncertainty-Quantification-for-Neural-Radiance-Fields-5c4bb6dc8a2b4ba0a9b2186e7066f7e5
17,page,dc72a115-9111-4c0a-8dcb-777868c07d09,2024-07-23T01:37:00.000Z,2024-07-23T01:38:00.000Z,"{'object': 'user', 'id': '11ba016d-f263-498e-a669-058948397991'}","{'object': 'user', 'id': '11ba016d-f263-498e-a669-058948397991'}",,,"{'type': 'database_id', 'database_id': '54cb3960-b402-46e2-be42-cfb58e2b45fd'}",False,False,"{'Last edited time': {'id': 'FM%3Dx', 'type': 'last_edited_time', 'last_edited_time': '2024-07-23T01:38:00.000Z'}, 'ConferenceDate': {'id': 'JnqY', 'type': 'date', 'date': {'start': '2024-07-22', 'end': None, 'time_zone': None}}, 'Authors': {'id': 'Km%3Db', 'type': 'rich_text', 'rich_text': [{'type': 'text', 'text': {'content': 'Shakiba Kheradmand, Daniel Rebain, Gopal Sharma, Hossam Isack, Abhishek Kar, Andrea Tagliasacchi, Kwang Moo Yi', 'link': None}, 'annotations': {'bold': False, 'italic': False, 'strikethrough': False, 'underline': False, 'code': False, 'color': 'default'}, 'plain_text': 'Shakiba Kheradmand, Daniel Rebain, Gopal Sharma, Hossam Isack, Abhishek Kar, Andrea Tagliasacchi, Kwang Moo Yi', 'href': None}]}, 'Last edited by': {'id': 'MZ%40S', 'type': 'last_edited_by', 'last_edited_by': {'object': 'user', 'id': '11ba016d-f263-498e-a669-058948397991'}}, 'Abstract': {'id': 'UIOf', 'type': 'rich_text', 'rich_text': [{'type': 'text', 'text': {'content': 'We present an approach to accelerate Neural Field training by efficiently selecting sampling locations. While Neural Fields have recently become popular, it is often trained by uniformly sampling the training domain, or through handcrafted heuristics. We show that improved convergence and final training quality can be achieved by a soft mining technique based on importance sampling: rather than either considering or ignoring a pixel completely, we weigh the corresponding loss by a scalar. To implement our idea we use Langevin Monte-Carlo sampling. We show that by doing so, regions with higher error are being selected more frequently, leading to more than 2x improvement in convergence speed.', 'link': None}, 'annotations': {'bold': False, 'italic': False, 'strikethrough': False, 'underline': False, 'code': False, 'color': 'default'}, 'plain_text': 'We present an approach to accelerate Neural Field training by efficiently selecting sampling locations. While Neural Fields have recently become popular, it is often trained by uniformly sampling the training domain, or through handcrafted heuristics. We show that improved convergence and final training quality can be achieved by a soft mining technique based on importance sampling: rather than either considering or ignoring a pixel completely, we weigh the corresponding loss by a scalar. To implement our idea we use Langevin Monte-Carlo sampling. We show that by doing so, regions with higher error are being selected more frequently, leading to more than 2x improvement in convergence speed.', 'href': None}]}, 'Thumbnail': {'id': 'YalY', 'type': 'files', 'files': [{'name': 'Screenshot 2024-07-22 at 6.38.13\u202fPM.png', 'type': 'file', 'file': {'url': 'https://prod-files-secure.s3.us-west-2.amazonaws.com/50d2f7ab-6ba6-45d4-bc3a-917e5e89e239/1d719c12-4254-42b2-9617-24e099d25684/Screenshot_2024-07-22_at_6.38.13_PM.png?X-Amz-Algorithm=AWS4-HMAC-SHA256&X-Amz-Content-Sha256=UNSIGNED-PAYLOAD&X-Amz-Credential=AKIAT73L2G45HZZMZUHI%2F20240923%2Fus-west-2%2Fs3%2Faws4_request&X-Amz-Date=20240923T192254Z&X-Amz-Expires=3600&X-Amz-Signature=f9641ff34a5e911552607f5094fee5d36aae0fa818d30855d605346a8cf70d6a&X-Amz-SignedHeaders=host&x-id=GetObject', 'expiry_time': '2024-09-23T20:22:54.142Z'}}]}, 'project_link': {'id': '%5D%5EpD', 'type': 'rich_text', 'rich_text': [{'type': 'text', 'text': {'content': 'https://ubc-vision.github.io/nf-soft-mining/', 'link': {'url': 'https://ubc-vision.github.io/nf-soft-mining/'}}, 'annotations': {'bold': False, 'italic': False, 'strikethrough': False, 'underline': False, 'code': False, 'color': 'default'}, 'plain_text': 'https://ubc-vision.github.io/nf-soft-mining/', 'href': 'https://ubc-vision.github.io/nf-soft-mining/'}]}, 'Venue': {'id': '_e%40%3F', 'type': 'rich_text', 'rich_text': [{'type': 'text', 'text': {'content': 'CVPR 2024', 'link': None}, 'annotations': {'bold': False, 'italic': False, 'strikethrough': False, 'underline': False, 'code': False, 'color': 'default'}, 'plain_text': 'CVPR 2024', 'href': None}]}, 'Created by': {'id': 'aBTi', 'type': 'created_by', 'created_by': {'object': 'user', 'id': '11ba016d-f263-498e-a669-058948397991'}}, 'video_link': {'id': 'k%5Ei%5D', 'type': 'rich_text', 'rich_text': []}, 'presentation_link': {'id': 'lwp%7D', 'type': 'rich_text', 'rich_text': []}, 'Tags': {'id': 'mula', 'type': 'multi_select', 'multi_select': [{'id': '1a31dc62-0b3c-4bfe-8684-3ffe669325d3', 'name': 'Andrea', 'color': 'purple'}, {'id': '1ffd3246-db7a-4ea8-855d-f920b194ab96', 'name': 'CVPR', 'color': 'orange'}]}, 'paper_link': {'id': 'ut%5Ex', 'type': 'rich_text', 'rich_text': [{'type': 'text', 'text': {'content': 'https://arxiv.org/pdf/2312.00075', 'link': {'url': 'https://arxiv.org/pdf/2312.00075'}}, 'annotations': {'bold': False, 'italic': False, 'strikethrough': False, 'underline': False, 'code': False, 'color': 'default'}, 'plain_text': 'https://arxiv.org/pdf/2312.00075', 'href': 'https://arxiv.org/pdf/2312.00075'}]}, 'If Valid': {'id': '%7C%3DNR', 'type': 'formula', 'formula': {'type': 'string', 'string': '✔️'}}, 'Name': {'id': 'title', 'type': 'title', 'title': [{'type': 'text', 'text': {'content': 'Accelerating Neural Field Training via Soft Mining', 'link': None}, 'annotations': {'bold': True, 'italic': False, 'strikethrough': False, 'underline': False, 'code': False, 'color': 'default'}, 'plain_text': 'Accelerating Neural Field Training via Soft Mining', 'href': None}]}}",https://www.notion.so/Accelerating-Neural-Field-Training-via-Soft-Mining-dc72a11591114c0a8dcb777868c07d09,https://yanxg.notion.site/Accelerating-Neural-Field-Training-via-Soft-Mining-dc72a11591114c0a8dcb777868c07d09
18,page,4f8c1c58-b6c1-4a8f-9bd7-a72ffa3d30b6,2024-07-23T01:36:00.000Z,2024-07-23T01:37:00.000Z,"{'object': 'user', 'id': '11ba016d-f263-498e-a669-058948397991'}","{'object': 'user', 'id': '11ba016d-f263-498e-a669-058948397991'}",,,"{'type': 'database_id', 'database_id': '54cb3960-b402-46e2-be42-cfb58e2b45fd'}",False,False,"{'Last edited time': {'id': 'FM%3Dx', 'type': 'last_edited_time', 'last_edited_time': '2024-07-23T01:37:00.000Z'}, 'ConferenceDate': {'id': 'JnqY', 'type': 'date', 'date': {'start': '2024-07-22', 'end': None, 'time_zone': None}}, 'Authors': {'id': 'Km%3Db', 'type': 'rich_text', 'rich_text': [{'type': 'text', 'text': {'content': 'Eric Hedlin, Gopal Sharma, Shweta Mahajan, Hossam Isack, Abhishek Kar, Helge Rhodin, Andrea Tagliasacchi, Kwang Moo Yi', 'link': None}, 'annotations': {'bold': False, 'italic': False, 'strikethrough': False, 'underline': False, 'code': False, 'color': 'default'}, 'plain_text': 'Eric Hedlin, Gopal Sharma, Shweta Mahajan, Hossam Isack, Abhishek Kar, Helge Rhodin, Andrea Tagliasacchi, Kwang Moo Yi', 'href': None}]}, 'Last edited by': {'id': 'MZ%40S', 'type': 'last_edited_by', 'last_edited_by': {'object': 'user', 'id': '11ba016d-f263-498e-a669-058948397991'}}, 'Abstract': {'id': 'UIOf', 'type': 'rich_text', 'rich_text': [{'type': 'text', 'text': {'content': 'Unsupervised learning of keypoints and landmarks has seen significant progress with the help of modern neural network architectures, but performance is yet to match the supervised counterpart, making their practicability questionable. We leverage the emergent knowledge within text-to-image diffusion models, towards more robust unsupervised keypoints. Our core idea is to find text embeddings that would cause the generative model to consistently attend to compact regions in images (i.e. keypoints). To do so, we simply optimize the text embedding such that the cross-attention maps within the denoising network are localized as Gaussians with small standard deviations. We validate our performance on multiple dataset: the CelebA, CUB-200-2011, Tai-Chi-HD, DeepFashion, and Human3.6m datasets. We achieve significantly improved accuracy, sometimes even outperforming supervised ones, particularly for data that is non-aligned and less curated.', 'link': None}, 'annotations': {'bold': False, 'italic': False, 'strikethrough': False, 'underline': False, 'code': False, 'color': 'default'}, 'plain_text': 'Unsupervised learning of keypoints and landmarks has seen significant progress with the help of modern neural network architectures, but performance is yet to match the supervised counterpart, making their practicability questionable. We leverage the emergent knowledge within text-to-image diffusion models, towards more robust unsupervised keypoints. Our core idea is to find text embeddings that would cause the generative model to consistently attend to compact regions in images (i.e. keypoints). To do so, we simply optimize the text embedding such that the cross-attention maps within the denoising network are localized as Gaussians with small standard deviations. We validate our performance on multiple dataset: the CelebA, CUB-200-2011, Tai-Chi-HD, DeepFashion, and Human3.6m datasets. We achieve significantly improved accuracy, sometimes even outperforming supervised ones, particularly for data that is non-aligned and less curated.', 'href': None}]}, 'Thumbnail': {'id': 'YalY', 'type': 'files', 'files': [{'name': 'Screenshot 2024-07-22 at 6.36.49\u202fPM.png', 'type': 'file', 'file': {'url': 'https://prod-files-secure.s3.us-west-2.amazonaws.com/50d2f7ab-6ba6-45d4-bc3a-917e5e89e239/20dc0ad8-8931-486f-a8c1-8eacce400885/Screenshot_2024-07-22_at_6.36.49_PM.png?X-Amz-Algorithm=AWS4-HMAC-SHA256&X-Amz-Content-Sha256=UNSIGNED-PAYLOAD&X-Amz-Credential=AKIAT73L2G45HZZMZUHI%2F20240923%2Fus-west-2%2Fs3%2Faws4_request&X-Amz-Date=20240923T192254Z&X-Amz-Expires=3600&X-Amz-Signature=99d3ae4e98827efc4d7c46439e3d57891e47652a0989b40881ef47781253a7ba&X-Amz-SignedHeaders=host&x-id=GetObject', 'expiry_time': '2024-09-23T20:22:54.142Z'}}]}, 'project_link': {'id': '%5D%5EpD', 'type': 'rich_text', 'rich_text': [{'type': 'text', 'text': {'content': 'https://ubc-vision.github.io/StableKeypoints/', 'link': {'url': 'https://ubc-vision.github.io/StableKeypoints/'}}, 'annotations': {'bold': False, 'italic': False, 'strikethrough': False, 'underline': False, 'code': False, 'color': 'default'}, 'plain_text': 'https://ubc-vision.github.io/StableKeypoints/', 'href': 'https://ubc-vision.github.io/StableKeypoints/'}]}, 'Venue': {'id': '_e%40%3F', 'type': 'rich_text', 'rich_text': [{'type': 'text', 'text': {'content': 'CVPR 2024', 'link': None}, 'annotations': {'bold': False, 'italic': False, 'strikethrough': False, 'underline': False, 'code': False, 'color': 'default'}, 'plain_text': 'CVPR 2024', 'href': None}]}, 'Created by': {'id': 'aBTi', 'type': 'created_by', 'created_by': {'object': 'user', 'id': '11ba016d-f263-498e-a669-058948397991'}}, 'video_link': {'id': 'k%5Ei%5D', 'type': 'rich_text', 'rich_text': []}, 'presentation_link': {'id': 'lwp%7D', 'type': 'rich_text', 'rich_text': []}, 'Tags': {'id': 'mula', 'type': 'multi_select', 'multi_select': [{'id': '1a31dc62-0b3c-4bfe-8684-3ffe669325d3', 'name': 'Andrea', 'color': 'purple'}, {'id': '1ffd3246-db7a-4ea8-855d-f920b194ab96', 'name': 'CVPR', 'color': 'orange'}]}, 'paper_link': {'id': 'ut%5Ex', 'type': 'rich_text', 'rich_text': [{'type': 'text', 'text': {'content': 'https://arxiv.org/pdf/2312.00065', 'link': {'url': 'https://arxiv.org/pdf/2312.00065'}}, 'annotations': {'bold': False, 'italic': False, 'strikethrough': False, 'underline': False, 'code': False, 'color': 'default'}, 'plain_text': 'https://arxiv.org/pdf/2312.00065', 'href': 'https://arxiv.org/pdf/2312.00065'}]}, 'If Valid': {'id': '%7C%3DNR', 'type': 'formula', 'formula': {'type': 'string', 'string': '✔️'}}, 'Name': {'id': 'title', 'type': 'title', 'title': [{'type': 'text', 'text': {'content': 'Unsupervised Keypoints from Pretrained Diffusion Models', 'link': None}, 'annotations': {'bold': True, 'italic': False, 'strikethrough': False, 'underline': False, 'code': False, 'color': 'default'}, 'plain_text': 'Unsupervised Keypoints from Pretrained Diffusion Models', 'href': None}]}}",https://www.notion.so/Unsupervised-Keypoints-from-Pretrained-Diffusion-Models-4f8c1c58b6c14a8f9bd7a72ffa3d30b6,https://yanxg.notion.site/Unsupervised-Keypoints-from-Pretrained-Diffusion-Models-4f8c1c58b6c14a8f9bd7a72ffa3d30b6
19,page,0ebb847f-958b-4f88-93d6-321b31322c16,2024-07-23T01:34:00.000Z,2024-07-23T01:35:00.000Z,"{'object': 'user', 'id': '11ba016d-f263-498e-a669-058948397991'}","{'object': 'user', 'id': '11ba016d-f263-498e-a669-058948397991'}",,,"{'type': 'database_id', 'database_id': '54cb3960-b402-46e2-be42-cfb58e2b45fd'}",False,False,"{'Last edited time': {'id': 'FM%3Dx', 'type': 'last_edited_time', 'last_edited_time': '2024-07-23T01:35:00.000Z'}, 'ConferenceDate': {'id': 'JnqY', 'type': 'date', 'date': {'start': '2024-07-22', 'end': None, 'time_zone': None}}, 'Authors': {'id': 'Km%3Db', 'type': 'rich_text', 'rich_text': [{'type': 'text', 'text': {'content': 'Ahan Shabanov, Shrisudhan Govindarajan, Cody Reading, Daniel Rebain, Kwang Moo Yi, Andrea Tagliasacchi', 'link': None}, 'annotations': {'bold': False, 'italic': False, 'strikethrough': False, 'underline': False, 'code': False, 'color': 'default'}, 'plain_text': 'Ahan Shabanov, Shrisudhan Govindarajan, Cody Reading, Daniel Rebain, Kwang Moo Yi, Andrea Tagliasacchi', 'href': None}]}, 'Last edited by': {'id': 'MZ%40S', 'type': 'last_edited_by', 'last_edited_by': {'object': 'user', 'id': '11ba016d-f263-498e-a669-058948397991'}}, 'Abstract': {'id': 'UIOf', 'type': 'rich_text', 'rich_text': [{'type': 'text', 'text': {'content': 'Largely due to their implicit nature, neural fields lack a direct mechanism for filtering, as Fourier analysis from discrete signal processing is not directly applicable to these representations. Effective filtering of neural fields is critical to enable level-of-detail processing in downstream applications, and support operations that involve sampling the field on regular grids (e.g. marching cubes). Existing methods that attempt to decompose neural fields in the frequency domain either resort to heuristics or require extensive modifications to the neural field architecture. We show that via a simple modification, one can obtain neural fields that are low-pass filtered, and in turn show how this can be exploited to obtain a frequency decomposition of the entire signal. We demonstrate the validity of our technique by investigating level-of-detail reconstruction, and showing how coarser representations can be computed effectively.', 'link': None}, 'annotations': {'bold': False, 'italic': False, 'strikethrough': False, 'underline': False, 'code': False, 'color': 'default'}, 'plain_text': 'Largely due to their implicit nature, neural fields lack a direct mechanism for filtering, as Fourier analysis from discrete signal processing is not directly applicable to these representations. Effective filtering of neural fields is critical to enable level-of-detail processing in downstream applications, and support operations that involve sampling the field on regular grids (e.g. marching cubes). Existing methods that attempt to decompose neural fields in the frequency domain either resort to heuristics or require extensive modifications to the neural field architecture. We show that via a simple modification, one can obtain neural fields that are low-pass filtered, and in turn show how this can be exploited to obtain a frequency decomposition of the entire signal. We demonstrate the validity of our technique by investigating level-of-detail reconstruction, and showing how coarser representations can be computed effectively.', 'href': None}]}, 'Thumbnail': {'id': 'YalY', 'type': 'files', 'files': [{'name': 'Screenshot 2024-07-22 at 6.35.07\u202fPM.png', 'type': 'file', 'file': {'url': 'https://prod-files-secure.s3.us-west-2.amazonaws.com/50d2f7ab-6ba6-45d4-bc3a-917e5e89e239/8e28041a-b60d-488c-991c-e22d5a3f370b/Screenshot_2024-07-22_at_6.35.07_PM.png?X-Amz-Algorithm=AWS4-HMAC-SHA256&X-Amz-Content-Sha256=UNSIGNED-PAYLOAD&X-Amz-Credential=AKIAT73L2G45HZZMZUHI%2F20240923%2Fus-west-2%2Fs3%2Faws4_request&X-Amz-Date=20240923T192254Z&X-Amz-Expires=3600&X-Amz-Signature=943ea91345f910ba9331ed485f7a6d606e807431e80882acd3a84a090642a952&X-Amz-SignedHeaders=host&x-id=GetObject', 'expiry_time': '2024-09-23T20:22:54.143Z'}}]}, 'project_link': {'id': '%5D%5EpD', 'type': 'rich_text', 'rich_text': [{'type': 'text', 'text': {'content': 'https://theialab.github.io/banf/', 'link': {'url': 'https://theialab.github.io/banf/'}}, 'annotations': {'bold': False, 'italic': False, 'strikethrough': False, 'underline': False, 'code': False, 'color': 'default'}, 'plain_text': 'https://theialab.github.io/banf/', 'href': 'https://theialab.github.io/banf/'}]}, 'Venue': {'id': '_e%40%3F', 'type': 'rich_text', 'rich_text': [{'type': 'text', 'text': {'content': 'CVPR 2024', 'link': None}, 'annotations': {'bold': False, 'italic': False, 'strikethrough': False, 'underline': False, 'code': False, 'color': 'default'}, 'plain_text': 'CVPR 2024', 'href': None}]}, 'Created by': {'id': 'aBTi', 'type': 'created_by', 'created_by': {'object': 'user', 'id': '11ba016d-f263-498e-a669-058948397991'}}, 'video_link': {'id': 'k%5Ei%5D', 'type': 'rich_text', 'rich_text': []}, 'presentation_link': {'id': 'lwp%7D', 'type': 'rich_text', 'rich_text': []}, 'Tags': {'id': 'mula', 'type': 'multi_select', 'multi_select': [{'id': '1a31dc62-0b3c-4bfe-8684-3ffe669325d3', 'name': 'Andrea', 'color': 'purple'}, {'id': '1ffd3246-db7a-4ea8-855d-f920b194ab96', 'name': 'CVPR', 'color': 'orange'}]}, 'paper_link': {'id': 'ut%5Ex', 'type': 'rich_text', 'rich_text': [{'type': 'text', 'text': {'content': 'https://arxiv.org/pdf/2404.13024', 'link': {'url': 'https://arxiv.org/pdf/2404.13024'}}, 'annotations': {'bold': False, 'italic': False, 'strikethrough': False, 'underline': False, 'code': False, 'color': 'default'}, 'plain_text': 'https://arxiv.org/pdf/2404.13024', 'href': 'https://arxiv.org/pdf/2404.13024'}]}, 'If Valid': {'id': '%7C%3DNR', 'type': 'formula', 'formula': {'type': 'string', 'string': '✔️'}}, 'Name': {'id': 'title', 'type': 'title', 'title': [{'type': 'text', 'text': {'content': 'BANF: Band-limited Neural Fields for Levels of Detail Reconstruction', 'link': None}, 'annotations': {'bold': True, 'italic': False, 'strikethrough': False, 'underline': False, 'code': False, 'color': 'default'}, 'plain_text': 'BANF: Band-limited Neural Fields for Levels of Detail Reconstruction', 'href': None}]}}",https://www.notion.so/BANF-Band-limited-Neural-Fields-for-Levels-of-Detail-Reconstruction-0ebb847f958b4f8893d6321b31322c16,https://yanxg.notion.site/BANF-Band-limited-Neural-Fields-for-Levels-of-Detail-Reconstruction-0ebb847f958b4f8893d6321b31322c16
