,object,id,created_time,last_edited_time,created_by,last_edited_by,cover,icon,parent,archived,in_trash,properties,url,public_url
0,page,20ea0ea9-bfe5-465f-ac7a-4e4423f5fc18,2024-08-01T17:48:00.000Z,2024-08-26T20:53:00.000Z,"{'object': 'user', 'id': '6449ae1c-47ea-4118-b87f-793dc03baabc'}","{'object': 'user', 'id': 'edfa4d94-358b-4482-91a3-67133bc15be8'}",,,"{'type': 'database_id', 'database_id': '54cb3960-b402-46e2-be42-cfb58e2b45fd'}",False,False,"{'Last edited time': {'id': 'FM%3Dx', 'type': 'last_edited_time', 'last_edited_time': '2024-08-26T20:53:00.000Z'}, 'ConferenceDate': {'id': 'JnqY', 'type': 'date', 'date': {'start': '2024-09-29', 'end': None, 'time_zone': None}}, 'Authors': {'id': 'Km%3Db', 'type': 'rich_text', 'rich_text': [{'type': 'text', 'text': {'content': 'Qirui Wu, Sonia Raychaudhuri, Daniel Ritchie, Manolis Savva, Angel X. Chang', 'link': None}, 'annotations': {'bold': False, 'italic': False, 'strikethrough': False, 'underline': False, 'code': False, 'color': 'default'}, 'plain_text': 'Qirui Wu, Sonia Raychaudhuri, Daniel Ritchie, Manolis Savva, Angel X. Chang', 'href': None}]}, 'Last edited by': {'id': 'MZ%40S', 'type': 'last_edited_by', 'last_edited_by': {'object': 'user', 'id': 'edfa4d94-358b-4482-91a3-67133bc15be8'}}, 'Abstract': {'id': 'UIOf', 'type': 'rich_text', 'rich_text': []}, 'Thumbnail': {'id': 'YalY', 'type': 'files', 'files': [{'name': 'https://qiruiw.github.io/assets/img/publication_preview/r3ds-480.webp', 'type': 'external', 'external': {'url': 'https://qiruiw.github.io/assets/img/publication_preview/r3ds-480.webp'}}]}, 'project_link': {'id': '%5D%5EpD', 'type': 'rich_text', 'rich_text': [{'type': 'text', 'text': {'content': 'https://3dlg-hcvc.github.io/r3ds/', 'link': {'url': 'https://3dlg-hcvc.github.io/r3ds/'}}, 'annotations': {'bold': False, 'italic': False, 'strikethrough': False, 'underline': False, 'code': False, 'color': 'default'}, 'plain_text': 'https://3dlg-hcvc.github.io/r3ds/', 'href': 'https://3dlg-hcvc.github.io/r3ds/'}]}, 'Venue': {'id': '_e%40%3F', 'type': 'rich_text', 'rich_text': [{'type': 'text', 'text': {'content': 'ECCV 2024', 'link': None}, 'annotations': {'bold': False, 'italic': False, 'strikethrough': False, 'underline': False, 'code': False, 'color': 'default'}, 'plain_text': 'ECCV 2024', 'href': None}]}, 'Created by': {'id': 'aBTi', 'type': 'created_by', 'created_by': {'object': 'user', 'id': '6449ae1c-47ea-4118-b87f-793dc03baabc'}}, 'video_link': {'id': 'k%5Ei%5D', 'type': 'rich_text', 'rich_text': [{'type': 'text', 'text': {'content': 'https://youtu.be/waI3m7TuyNA', 'link': {'url': 'https://youtu.be/waI3m7TuyNA'}}, 'annotations': {'bold': False, 'italic': False, 'strikethrough': False, 'underline': False, 'code': False, 'color': 'default'}, 'plain_text': 'https://youtu.be/waI3m7TuyNA', 'href': 'https://youtu.be/waI3m7TuyNA'}]}, 'presentation_link': {'id': 'lwp%7D', 'type': 'rich_text', 'rich_text': []}, 'Tags': {'id': 'mula', 'type': 'multi_select', 'multi_select': [{'id': '5cbe73f7-7a55-4251-80d4-2375865f5724', 'name': 'ECCV', 'color': 'yellow'}, {'id': '3f09b3b2-12ce-418c-8bbd-329349d82802', 'name': 'Angel', 'color': 'brown'}, {'id': 'bccbeae3-55ce-4b38-9abc-61c658ca30b4', 'name': 'Manolis', 'color': 'blue'}]}, 'paper_link': {'id': 'ut%5Ex', 'type': 'rich_text', 'rich_text': [{'type': 'text', 'text': {'content': 'https://arxiv.org/abs/2403.12301', 'link': {'url': 'https://arxiv.org/abs/2403.12301'}}, 'annotations': {'bold': False, 'italic': False, 'strikethrough': False, 'underline': False, 'code': False, 'color': 'default'}, 'plain_text': 'https://arxiv.org/abs/2403.12301', 'href': 'https://arxiv.org/abs/2403.12301'}]}, 'If Valid': {'id': '%7C%3DNR', 'type': 'formula', 'formula': {'type': 'string', 'string': '✔️'}}, 'Name': {'id': 'title', 'type': 'title', 'title': [{'type': 'text', 'text': {'content': 'R3DS: Reality-linked 3D Scenes for Panoramic Scene Understanding', 'link': None}, 'annotations': {'bold': True, 'italic': False, 'strikethrough': False, 'underline': False, 'code': False, 'color': 'default'}, 'plain_text': 'R3DS: Reality-linked 3D Scenes for Panoramic Scene Understanding', 'href': None}]}}",https://www.notion.so/R3DS-Reality-linked-3D-Scenes-for-Panoramic-Scene-Understanding-20ea0ea9bfe5465fac7a4e4423f5fc18,https://yanxg.notion.site/R3DS-Reality-linked-3D-Scenes-for-Panoramic-Scene-Understanding-20ea0ea9bfe5465fac7a4e4423f5fc18
1,page,f5e85155-e234-4db6-a8ff-62ab0562cdb4,2024-07-23T18:13:00.000Z,2024-08-26T20:53:00.000Z,"{'object': 'user', 'id': 'bd7176b3-a752-4e75-aaed-ceb6cba2b982'}","{'object': 'user', 'id': 'edfa4d94-358b-4482-91a3-67133bc15be8'}",,,"{'type': 'database_id', 'database_id': '54cb3960-b402-46e2-be42-cfb58e2b45fd'}",False,False,"{'Last edited time': {'id': 'FM%3Dx', 'type': 'last_edited_time', 'last_edited_time': '2024-08-26T20:53:00.000Z'}, 'ConferenceDate': {'id': 'JnqY', 'type': 'date', 'date': {'start': '2024-09-29', 'end': None, 'time_zone': None}}, 'Authors': {'id': 'Km%3Db', 'type': 'rich_text', 'rich_text': [{'type': 'text', 'text': {'content': 'Sebastian Dille, Chris Careaga, Yağız Aksoy', 'link': None}, 'annotations': {'bold': False, 'italic': False, 'strikethrough': False, 'underline': False, 'code': False, 'color': 'default'}, 'plain_text': 'Sebastian Dille, Chris Careaga, Yağız Aksoy', 'href': None}]}, 'Last edited by': {'id': 'MZ%40S', 'type': 'last_edited_by', 'last_edited_by': {'object': 'user', 'id': 'edfa4d94-358b-4482-91a3-67133bc15be8'}}, 'Abstract': {'id': 'UIOf', 'type': 'rich_text', 'rich_text': [{'type': 'text', 'text': {'content': 'The low dynamic range (LDR) of common cameras fails tocapture the rich contrast in natural scenes, resulting in loss of colorand details in saturated pixels. Reconstructing the high dynamic range(HDR) of luminance present in the scene from single LDR photographs isan important task with many applications in computational photographyand realistic display of images. The HDR reconstruction task aims to in-fer the lost details using the context present in the scene, requiring neuralnetworks to understand high-level geometric and illumination cues. Thismakes it challenging for data-driven algorithms to generate accurate andhigh-resolution results. In this work, we introduce a physically-inspiredremodeling of the HDR reconstruction problem in the intrinsic domain.The intrinsic model allows us to train separate networks to extend thedynamic range in the shading domain and to recover lost color details inthe albedo domain. We show that dividing the problem into two simplersub-tasks improves performance in a wide variety of photographs.', 'link': None}, 'annotations': {'bold': False, 'italic': False, 'strikethrough': False, 'underline': False, 'code': False, 'color': 'default'}, 'plain_text': 'The low dynamic range (LDR) of common cameras fails tocapture the rich contrast in natural scenes, resulting in loss of colorand details in saturated pixels. Reconstructing the high dynamic range(HDR) of luminance present in the scene from single LDR photographs isan important task with many applications in computational photographyand realistic display of images. The HDR reconstruction task aims to in-fer the lost details using the context present in the scene, requiring neuralnetworks to understand high-level geometric and illumination cues. Thismakes it challenging for data-driven algorithms to generate accurate andhigh-resolution results. In this work, we introduce a physically-inspiredremodeling of the HDR reconstruction problem in the intrinsic domain.The intrinsic model allows us to train separate networks to extend thedynamic range in the shading domain and to recover lost color details inthe albedo domain. We show that dividing the problem into two simplersub-tasks improves performance in a wide variety of photographs.', 'href': None}]}, 'Thumbnail': {'id': 'YalY', 'type': 'files', 'files': [{'name': 'intrinsicHDR_thumb.jpg', 'type': 'file', 'file': {'url': 'https://prod-files-secure.s3.us-west-2.amazonaws.com/50d2f7ab-6ba6-45d4-bc3a-917e5e89e239/c1076504-0907-4606-80d5-6e9aeb608f80/intrinsicHDR_thumb.jpg?X-Amz-Algorithm=AWS4-HMAC-SHA256&X-Amz-Content-Sha256=UNSIGNED-PAYLOAD&X-Amz-Credential=AKIAT73L2G45HZZMZUHI%2F20240923%2Fus-west-2%2Fs3%2Faws4_request&X-Amz-Date=20240923T192254Z&X-Amz-Expires=3600&X-Amz-Signature=e2ab72908747fc89cc8633832b3da2028b36ca93f60ca2dac81facd52f79b37c&X-Amz-SignedHeaders=host&x-id=GetObject', 'expiry_time': '2024-09-23T20:22:54.139Z'}}]}, 'project_link': {'id': '%5D%5EpD', 'type': 'rich_text', 'rich_text': [{'type': 'text', 'text': {'content': 'https://yaksoy.github.io/intrinsicHDR/', 'link': {'url': 'https://yaksoy.github.io/intrinsicHDR/'}}, 'annotations': {'bold': False, 'italic': False, 'strikethrough': False, 'underline': False, 'code': False, 'color': 'default'}, 'plain_text': 'https://yaksoy.github.io/intrinsicHDR/', 'href': 'https://yaksoy.github.io/intrinsicHDR/'}]}, 'Venue': {'id': '_e%40%3F', 'type': 'rich_text', 'rich_text': [{'type': 'text', 'text': {'content': 'ECCV 2024', 'link': None}, 'annotations': {'bold': False, 'italic': False, 'strikethrough': False, 'underline': False, 'code': False, 'color': 'default'}, 'plain_text': 'ECCV 2024', 'href': None}]}, 'Created by': {'id': 'aBTi', 'type': 'created_by', 'created_by': {'object': 'user', 'id': 'bd7176b3-a752-4e75-aaed-ceb6cba2b982'}}, 'video_link': {'id': 'k%5Ei%5D', 'type': 'rich_text', 'rich_text': []}, 'presentation_link': {'id': 'lwp%7D', 'type': 'rich_text', 'rich_text': []}, 'Tags': {'id': 'mula', 'type': 'multi_select', 'multi_select': [{'id': '5cbe73f7-7a55-4251-80d4-2375865f5724', 'name': 'ECCV', 'color': 'yellow'}, {'id': '3eb057d5-ed85-4850-b9ac-ff060c999382', 'name': 'Yagiz', 'color': 'gray'}]}, 'paper_link': {'id': 'ut%5Ex', 'type': 'rich_text', 'rich_text': [{'type': 'text', 'text': {'content': 'https://yaksoy.github.io/intrinsicHDR/', 'link': {'url': 'https://yaksoy.github.io/intrinsicHDR/'}}, 'annotations': {'bold': False, 'italic': False, 'strikethrough': False, 'underline': False, 'code': False, 'color': 'default'}, 'plain_text': 'https://yaksoy.github.io/intrinsicHDR/', 'href': 'https://yaksoy.github.io/intrinsicHDR/'}]}, 'If Valid': {'id': '%7C%3DNR', 'type': 'formula', 'formula': {'type': 'string', 'string': '✔️'}}, 'Name': {'id': 'title', 'type': 'title', 'title': [{'type': 'text', 'text': {'content': 'Intrinsic Single-Image HDR Reconstruction', 'link': None}, 'annotations': {'bold': False, 'italic': False, 'strikethrough': False, 'underline': False, 'code': False, 'color': 'default'}, 'plain_text': 'Intrinsic Single-Image HDR Reconstruction', 'href': None}]}}",https://www.notion.so/Intrinsic-Single-Image-HDR-Reconstruction-f5e85155e2344db6a8ff62ab0562cdb4,https://yanxg.notion.site/Intrinsic-Single-Image-HDR-Reconstruction-f5e85155e2344db6a8ff62ab0562cdb4
2,page,cb1a4dec-364b-4f0c-93a3-637df1003b8c,2024-07-23T01:28:00.000Z,2024-08-26T20:54:00.000Z,"{'object': 'user', 'id': '11ba016d-f263-498e-a669-058948397991'}","{'object': 'user', 'id': 'edfa4d94-358b-4482-91a3-67133bc15be8'}",,,"{'type': 'database_id', 'database_id': '54cb3960-b402-46e2-be42-cfb58e2b45fd'}",False,False,"{'Last edited time': {'id': 'FM%3Dx', 'type': 'last_edited_time', 'last_edited_time': '2024-08-26T20:54:00.000Z'}, 'ConferenceDate': {'id': 'JnqY', 'type': 'date', 'date': {'start': '2024-09-29', 'end': None, 'time_zone': None}}, 'Authors': {'id': 'Km%3Db', 'type': 'rich_text', 'rich_text': [{'type': 'text', 'text': {'content': 'Weiwei Sun, Eduard Trulls, Yang-Che Tseng, Sneha Sambandam, Gopal Sharma, Andrea Tagliasacchi, Kwang Moo Yi', 'link': None}, 'annotations': {'bold': False, 'italic': False, 'strikethrough': False, 'underline': False, 'code': False, 'color': 'default'}, 'plain_text': 'Weiwei Sun, Eduard Trulls, Yang-Che Tseng, Sneha Sambandam, Gopal Sharma, Andrea Tagliasacchi, Kwang Moo Yi', 'href': None}]}, 'Last edited by': {'id': 'MZ%40S', 'type': 'last_edited_by', 'last_edited_by': {'object': 'user', 'id': 'edfa4d94-358b-4482-91a3-67133bc15be8'}}, 'Abstract': {'id': 'UIOf', 'type': 'rich_text', 'rich_text': [{'type': 'text', 'text': {'content': ""Point clouds offer an attractive source of information to complement images in neural scene representations, especially when few images are available. Neural rendering methods based on point clouds do exist, but they do not perform well when the point cloud quality is low---e.g., sparse or incomplete, which is often the case with real-world data. We overcome these problems with a simple representation that aggregates point clouds at multiple scale levels with sparse voxel grids at different resolutions. To deal with point cloud sparsity, we average across multiple scale levels---but only among those that are valid, i.e., that have enough neighboring points in proximity to the ray of a pixel. To help model areas without points, we add a global voxel at the coarsest scale, thus unifying ``classical'' and point-based NeRF formulations. We validate our method on the NeRF Synthetic, ScanNet, and KITTI-360 datasets, outperforming the state of the art by a significant margin."", 'link': None}, 'annotations': {'bold': False, 'italic': False, 'strikethrough': False, 'underline': False, 'code': False, 'color': 'default'}, 'plain_text': ""Point clouds offer an attractive source of information to complement images in neural scene representations, especially when few images are available. Neural rendering methods based on point clouds do exist, but they do not perform well when the point cloud quality is low---e.g., sparse or incomplete, which is often the case with real-world data. We overcome these problems with a simple representation that aggregates point clouds at multiple scale levels with sparse voxel grids at different resolutions. To deal with point cloud sparsity, we average across multiple scale levels---but only among those that are valid, i.e., that have enough neighboring points in proximity to the ray of a pixel. To help model areas without points, we add a global voxel at the coarsest scale, thus unifying ``classical'' and point-based NeRF formulations. We validate our method on the NeRF Synthetic, ScanNet, and KITTI-360 datasets, outperforming the state of the art by a significant margin."", 'href': None}]}, 'Thumbnail': {'id': 'YalY', 'type': 'files', 'files': [{'name': 'Screenshot 2024-07-22 at 6.29.19\u202fPM.png', 'type': 'file', 'file': {'url': 'https://prod-files-secure.s3.us-west-2.amazonaws.com/50d2f7ab-6ba6-45d4-bc3a-917e5e89e239/2355d1c7-bf38-4c00-80e5-e56ff9ca9f6d/Screenshot_2024-07-22_at_6.29.19_PM.png?X-Amz-Algorithm=AWS4-HMAC-SHA256&X-Amz-Content-Sha256=UNSIGNED-PAYLOAD&X-Amz-Credential=AKIAT73L2G45HZZMZUHI%2F20240923%2Fus-west-2%2Fs3%2Faws4_request&X-Amz-Date=20240923T192254Z&X-Amz-Expires=3600&X-Amz-Signature=7fc5a73fea7b50726b22f64a4e69848191561e188cf6ee1f7ff924beb5d26df3&X-Amz-SignedHeaders=host&x-id=GetObject', 'expiry_time': '2024-09-23T20:22:54.140Z'}}]}, 'project_link': {'id': '%5D%5EpD', 'type': 'rich_text', 'rich_text': [{'type': 'text', 'text': {'content': 'https://pointnerfpp.github.io', 'link': {'url': 'https://pointnerfpp.github.io/'}}, 'annotations': {'bold': False, 'italic': False, 'strikethrough': False, 'underline': False, 'code': False, 'color': 'default'}, 'plain_text': 'https://pointnerfpp.github.io', 'href': 'https://pointnerfpp.github.io/'}]}, 'Venue': {'id': '_e%40%3F', 'type': 'rich_text', 'rich_text': [{'type': 'text', 'text': {'content': 'ECCV 2024', 'link': None}, 'annotations': {'bold': False, 'italic': False, 'strikethrough': False, 'underline': False, 'code': False, 'color': 'default'}, 'plain_text': 'ECCV 2024', 'href': None}]}, 'Created by': {'id': 'aBTi', 'type': 'created_by', 'created_by': {'object': 'user', 'id': '11ba016d-f263-498e-a669-058948397991'}}, 'video_link': {'id': 'k%5Ei%5D', 'type': 'rich_text', 'rich_text': []}, 'presentation_link': {'id': 'lwp%7D', 'type': 'rich_text', 'rich_text': []}, 'Tags': {'id': 'mula', 'type': 'multi_select', 'multi_select': [{'id': '5cbe73f7-7a55-4251-80d4-2375865f5724', 'name': 'ECCV', 'color': 'yellow'}, {'id': '1a31dc62-0b3c-4bfe-8684-3ffe669325d3', 'name': 'Andrea', 'color': 'purple'}]}, 'paper_link': {'id': 'ut%5Ex', 'type': 'rich_text', 'rich_text': [{'type': 'text', 'text': {'content': 'https://pointnerfpp.github.io/resources/paper.pdf', 'link': {'url': 'https://pointnerfpp.github.io/resources/paper.pdf'}}, 'annotations': {'bold': False, 'italic': False, 'strikethrough': False, 'underline': False, 'code': False, 'color': 'default'}, 'plain_text': 'https://pointnerfpp.github.io/resources/paper.pdf', 'href': 'https://pointnerfpp.github.io/resources/paper.pdf'}]}, 'If Valid': {'id': '%7C%3DNR', 'type': 'formula', 'formula': {'type': 'string', 'string': '✔️'}}, 'Name': {'id': 'title', 'type': 'title', 'title': [{'type': 'text', 'text': {'content': 'PointNeRF++: A multi-scale, point-based Neural Radiance Field', 'link': None}, 'annotations': {'bold': True, 'italic': False, 'strikethrough': False, 'underline': False, 'code': False, 'color': 'default'}, 'plain_text': 'PointNeRF++: A multi-scale, point-based Neural Radiance Field', 'href': None}]}}",https://www.notion.so/PointNeRF-A-multi-scale-point-based-Neural-Radiance-Field-cb1a4dec364b4f0c93a3637df1003b8c,https://yanxg.notion.site/PointNeRF-A-multi-scale-point-based-Neural-Radiance-Field-cb1a4dec364b4f0c93a3637df1003b8c
3,page,3b948533-0704-49d1-8c48-8f31094e0ffe,2024-07-23T01:25:00.000Z,2024-08-26T20:54:00.000Z,"{'object': 'user', 'id': '11ba016d-f263-498e-a669-058948397991'}","{'object': 'user', 'id': 'edfa4d94-358b-4482-91a3-67133bc15be8'}",,,"{'type': 'database_id', 'database_id': '54cb3960-b402-46e2-be42-cfb58e2b45fd'}",False,False,"{'Last edited time': {'id': 'FM%3Dx', 'type': 'last_edited_time', 'last_edited_time': '2024-08-26T20:54:00.000Z'}, 'ConferenceDate': {'id': 'JnqY', 'type': 'date', 'date': {'start': '2024-09-29', 'end': None, 'time_zone': None}}, 'Authors': {'id': 'Km%3Db', 'type': 'rich_text', 'rich_text': [{'type': 'text', 'text': {'content': 'Gopal Sharma, Daniel Rebain, Kwang Moo Yi, Andrea Tagliasacchi', 'link': None}, 'annotations': {'bold': False, 'italic': False, 'strikethrough': False, 'underline': False, 'code': False, 'color': 'default'}, 'plain_text': 'Gopal Sharma, Daniel Rebain, Kwang Moo Yi, Andrea Tagliasacchi', 'href': None}]}, 'Last edited by': {'id': 'MZ%40S', 'type': 'last_edited_by', 'last_edited_by': {'object': 'user', 'id': 'edfa4d94-358b-4482-91a3-67133bc15be8'}}, 'Abstract': {'id': 'UIOf', 'type': 'rich_text', 'rich_text': [{'type': 'text', 'text': {'content': 'We propose a novel Neural Radiance Field (NeRF) representation for non-opaque scenes that allows fast inference by utilizing textured polygons. Despite the high-quality novel view rendering that NeRF provides, a critical limitation is that it relies on volume rendering that can be computationally expensive and does not utilize the advancements in modern graphics hardware. Existing methods for this problem fall short when it comes to modelling volumetric effects as they rely purely on surface rendering. We thus propose to model the scene with polygons, which can then be used to obtain the quadrature points required to model volumetric effects, and also their opacity and colour from the texture. To obtain such polygonal mesh, we train a specialized field whose zero-crossings would correspond to the quadrature points when volume rendering, and perform marching cubes on this field. We then rasterize the polygons and utilize the fragment shaders to obtain the final colour image. Our method allows rendering on various devices and easy integration with existing graphics frameworks while keeping the benefits of volume rendering alive.', 'link': None}, 'annotations': {'bold': False, 'italic': False, 'strikethrough': False, 'underline': False, 'code': False, 'color': 'default'}, 'plain_text': 'We propose a novel Neural Radiance Field (NeRF) representation for non-opaque scenes that allows fast inference by utilizing textured polygons. Despite the high-quality novel view rendering that NeRF provides, a critical limitation is that it relies on volume rendering that can be computationally expensive and does not utilize the advancements in modern graphics hardware. Existing methods for this problem fall short when it comes to modelling volumetric effects as they rely purely on surface rendering. We thus propose to model the scene with polygons, which can then be used to obtain the quadrature points required to model volumetric effects, and also their opacity and colour from the texture. To obtain such polygonal mesh, we train a specialized field whose zero-crossings would correspond to the quadrature points when volume rendering, and perform marching cubes on this field. We then rasterize the polygons and utilize the fragment shaders to obtain the final colour image. Our method allows rendering on various devices and easy integration with existing graphics frameworks while keeping the benefits of volume rendering alive.', 'href': None}]}, 'Thumbnail': {'id': 'YalY', 'type': 'files', 'files': [{'name': 'Screenshot 2024-07-22 at 6.26.36\u202fPM.png', 'type': 'file', 'file': {'url': 'https://prod-files-secure.s3.us-west-2.amazonaws.com/50d2f7ab-6ba6-45d4-bc3a-917e5e89e239/4418d584-258e-404e-ae1d-7601a3ff78ef/Screenshot_2024-07-22_at_6.26.36_PM.png?X-Amz-Algorithm=AWS4-HMAC-SHA256&X-Amz-Content-Sha256=UNSIGNED-PAYLOAD&X-Amz-Credential=AKIAT73L2G45HZZMZUHI%2F20240923%2Fus-west-2%2Fs3%2Faws4_request&X-Amz-Date=20240923T192254Z&X-Amz-Expires=3600&X-Amz-Signature=0eabf3eefcf7c3ab1e1d909bf207a2c615e55913fb448dadcc52d85243867ee7&X-Amz-SignedHeaders=host&x-id=GetObject', 'expiry_time': '2024-09-23T20:22:54.140Z'}}]}, 'project_link': {'id': '%5D%5EpD', 'type': 'rich_text', 'rich_text': [{'type': 'text', 'text': {'content': 'https://quadraturefields.github.io', 'link': {'url': 'https://quadraturefields.github.io/'}}, 'annotations': {'bold': False, 'italic': False, 'strikethrough': False, 'underline': False, 'code': False, 'color': 'default'}, 'plain_text': 'https://quadraturefields.github.io', 'href': 'https://quadraturefields.github.io/'}]}, 'Venue': {'id': '_e%40%3F', 'type': 'rich_text', 'rich_text': [{'type': 'text', 'text': {'content': 'ECCV 2024', 'link': None}, 'annotations': {'bold': False, 'italic': False, 'strikethrough': False, 'underline': False, 'code': False, 'color': 'default'}, 'plain_text': 'ECCV 2024', 'href': None}]}, 'Created by': {'id': 'aBTi', 'type': 'created_by', 'created_by': {'object': 'user', 'id': '11ba016d-f263-498e-a669-058948397991'}}, 'video_link': {'id': 'k%5Ei%5D', 'type': 'rich_text', 'rich_text': []}, 'presentation_link': {'id': 'lwp%7D', 'type': 'rich_text', 'rich_text': []}, 'Tags': {'id': 'mula', 'type': 'multi_select', 'multi_select': [{'id': '5cbe73f7-7a55-4251-80d4-2375865f5724', 'name': 'ECCV', 'color': 'yellow'}, {'id': '1a31dc62-0b3c-4bfe-8684-3ffe669325d3', 'name': 'Andrea', 'color': 'purple'}]}, 'paper_link': {'id': 'ut%5Ex', 'type': 'rich_text', 'rich_text': [{'type': 'text', 'text': {'content': 'https://quadraturefields.github.io/static/pdfs/paper.pdf', 'link': {'url': 'https://quadraturefields.github.io/static/pdfs/paper.pdf'}}, 'annotations': {'bold': False, 'italic': False, 'strikethrough': False, 'underline': False, 'code': False, 'color': 'default'}, 'plain_text': 'https://quadraturefields.github.io/static/pdfs/paper.pdf', 'href': 'https://quadraturefields.github.io/static/pdfs/paper.pdf'}]}, 'If Valid': {'id': '%7C%3DNR', 'type': 'formula', 'formula': {'type': 'string', 'string': '✔️'}}, 'Name': {'id': 'title', 'type': 'title', 'title': [{'type': 'text', 'text': {'content': 'Volumetric Rendering with Baked Quadrature Fields', 'link': None}, 'annotations': {'bold': True, 'italic': False, 'strikethrough': False, 'underline': False, 'code': False, 'color': 'default'}, 'plain_text': 'Volumetric Rendering with Baked Quadrature Fields', 'href': None}]}}",https://www.notion.so/Volumetric-Rendering-with-Baked-Quadrature-Fields-3b948533070449d18c488f31094e0ffe,https://yanxg.notion.site/Volumetric-Rendering-with-Baked-Quadrature-Fields-3b948533070449d18c488f31094e0ffe
